{
    "id": "knuth-ctan",
    "name": "Knuth CTAN License",
    "creator": [],
    "since": "",
    "description": "",
    "permissions": [],
    "conditions": [],
    "limitations": [],
    "body": "This software is copyrighted. Unlimited copying and redistribution of this package and/or its individual files are permitted as long as there are no modifications. Modifications, and redistribution of modifications, are also permitted, but only if the resulting package and/or files are renamed.",
    "type": "source-available"
}