{
    "id": "tpdl",
    "name": "Time::ParseDate License",
    "creator": [],
    "since": "",
    "description": "",
    "permissions": [],
    "conditions": [],
    "limitations": [],
    "body": "Copyright (C) 1996-2010 David Muir Sharnoff. Copyright (C) 2011 Google, Inc.\n\nLicense hereby granted for anyone to use, modify or redistribute this module at their own risk. Please feed useful changes back to cpan@dave.sharnoff.org.",
    "type": "source-available"
}