{
    "id": "zed",
    "name": "Zed License",
    "creator": [],
    "since": "",
    "description": "",
    "permissions": [],
    "conditions": [],
    "limitations": [],
    "body": "(c) Jim Davies, January 1995\n\nYou may copy and distribute this file freely. Any queries and complaints should be forwarded to Jim.Davies@comlab.ox.ac.uk.\n\nIf you make any changes to this file, please do not distribute the results under the name `zed-csp.sty'.",
    "type": "source-available"
}