{
    "id": "nlpl",
    "name": "No Limit Public License",
    "creator": [],
    "since": "",
    "description": "",
    "permissions": [],
    "conditions": [],
    "limitations": [],
    "body": "?-?Gilles LAMIRAL La Billais 35580 Baulon France?-?\n\nTerms and conditions for copying, distribution, modification or anything else.\n\n0. No limit to do anything with this work and this license.",
    "type": "source-available"
}