{
    "id": "borceux",
    "name": "Borceux license",
    "creator": [],
    "since": "",
    "description": "",
    "permissions": [],
    "conditions": [],
    "limitations": [],
    "body": "Copyright 1993 Francis Borceux\n\nYou may freely use, modify, and/or distribute each of the files in this package without limitation. The package consists of the following files: README compatibility/OldDiagram compatibility/OldMaxiDiagram compatibility/OldMicroDiagram compatibility/OldMiniDiagram compatibility/OldMultipleArrows diagram/Diagram diagram/MaxiDiagram diagram/MicroDiagram diagram/MiniDiagram diagram/MultipleArrows user-guides/Diagram_Mode_d_Emploi user-guides/Diagram_Read_Me\n\nOf course no support is guaranteed, but the author will attempt to assist with problems. Current email address: francis dot borceux at uclouvain dot be.",
    "type": "source-available"
}