{
    "id": "ttwl",
    "name": "Text-Tabs+Wrap License",
    "creator": [],
    "since": "",
    "description": "",
    "permissions": [],
    "conditions": [],
    "limitations": [],
    "body": "Copyright (C) 1996-2002,2005,2006 David Muir Sharnoff. Copyright (C) 2005 Aristotle Pagaltzis Copyright (C) 2012-2013 Google, Inc.\n\nThis module may be modified, used, copied, and redistributed at your own risk. Although allowed by the preceding license, please do not publicly redistribute modified versions of this code with the name \"Text::Tabs\" unless it passes the unmodified Text::Tabs test suite.",
    "type": "source-available"
}