{
    "id": "ntp-0",
    "name": "NTP No Attribution",
    "creator": [],
    "since": "",
    "description": "",
    "permissions": [],
    "conditions": [],
    "limitations": [],
    "body": "Copyright (4-digit-year) by (CopyrightHoldersName)\n\nPermission to use, copy, modify, and distribute this software and its documentation for any purpose is hereby granted, provided that the name ?-?s?-? of <-<(TrademarkedName)>-> not be used in advertising or publicity pertaining to distribution of the software without specific, written prior permission. <-<(TrademarkedName)>-> make ?-?s?-? no representations about the suitability of this software for any purpose. It is provided \"as is\" without express or implied warranty.",
    "type": "source-available"
}