{
    "id": "wtfpl",
    "name": "Do What The F*ck You Want To Public License",
    "creator": [],
    "since": "",
    "description": "",
    "permissions": [],
    "conditions": [],
    "limitations": [],
    "body": "Copyright (C) 2004 Sam Hocevar <sam@hocevar.net>\n\nEveryone is permitted to copy and distribute verbatim or modified copies of this license document, and changing it is allowed as long as the name is changed.\n\nDO WHAT THE FUCK YOU WANT TO PUBLIC LICENSE TERMS AND CONDITIONS FOR COPYING, DISTRIBUTION AND MODIFICATION\n\n0. You just DO WHAT THE FUCK YOU WANT TO.",
    "type": "source-available"
}