{
    "id": "mit-modern-variant",
    "name": "MIT License Modern Variant",
    "creator": [],
    "since": "",
    "description": "",
    "permissions": [],
    "conditions": [],
    "limitations": [],
    "body": "Copyright Â© 1990-2021 The Regents of the University of California. All rights reserved.\n\nPermission is hereby granted, without written agreement and without license or royalty fees, to use, copy, modify, and distribute this software and its documentation for any purpose, provided that the above copyright notice and the following two paragraphs appear in all copies of this software.\n\nIN NO EVENT SHALL <-<THE UNIVERSITY OF CALIFORNIA>-> BE LIABLE TO ANY PARTY FOR DIRECT, INDIRECT, SPECIAL, INCIDENTAL, OR CONSEQUENTIAL DAMAGES ARISING OUT OF THE USE OF THIS SOFTWARE AND ITS DOCUMENTATION, EVEN IF <-<THE UNIVERSITY OF CALIFORNIA>-> HAS BEEN ADVISED OF THE POSSIBILITY OF SUCH DAMAGE.\n\n<-<THE UNIVERSITY OF CALIFORNIA>-> SPECIFICALLY DISCLAIMS ANY WARRANTIES, INCLUDING, BUT NOT LIMITED TO, THE IMPLIED WARRANTIES OF MERCHANTABILITY AND FITNESS FOR A PARTICULAR PURPOSE. THE SOFTWARE PROVIDED HEREUNDER IS ON AN \"AS IS\" BASIS, AND <-<THE UNIVERSITY OF CALIFORNIA>-> HAS NO OBLIGATION TO PROVIDE MAINTENANCE, SUPPORT, UPDATES, ENHANCEMENTS, OR MODIFICATIONS.",
    "type": "source-available"
}