{
    "id": "app-s2p",
    "name": "App::s2p License",
    "creator": [],
    "since": "",
    "description": "",
    "permissions": [],
    "conditions": [],
    "limitations": [],
    "body": "COPYRIGHT and LICENSE\n\nThis program is free and open software. You may use, modify, distribute, and sell this program (and any modified variants) in any way you wish, provided you do not restrict others from doing the same.",
    "type": "source-available"
}