{
    "id": "dotseqn",
    "name": "Dotseqn License",
    "creator": [],
    "since": "",
    "description": "",
    "permissions": [],
    "conditions": [],
    "limitations": [],
    "body": "Copyright (C) 1995 by Donald Arseneau\n\nThis file may be freely transmitted and reproduced, but it may not be changed unless the name is changed also (except that you may freely change the paper-size option for \\documentclass).\n\nThis notice must be left intact.",
    "type": "source-available"
}