{
    "id": "blessing",
    "name": "SQLite Blessing",
    "creator": [],
    "since": "",
    "description": "",
    "permissions": [],
    "conditions": [],
    "limitations": [],
    "body": "The author disclaims copyright to this source code. In place of a legal notice, here is a blessing:\n\nMay you do good and not evil.\nMay you find forgiveness for yourself and forgive others.\nMay you share freely, never taking more than you give.",
    "type": "source-available"
}