{
    "id": "diffmark",
    "name": "diffmark license",
    "creator": [],
    "since": "",
    "description": "",
    "permissions": [],
    "conditions": [],
    "limitations": [],
    "body": "1. you can do what you want with it\n2. I refuse any responsibility for the consequences",
    "type": "source-available"
}