{
    "id": "glwtpl",
    "name": "Good Luck With That Public License",
    "creator": [],
    "since": "",
    "description": "",
    "permissions": [],
    "conditions": [],
    "limitations": [],
    "body": "Copyright (c) Everyone, except Author\n\nEveryone is permitted to copy, distribute, modify, merge, sell, publish, sublicense or whatever they want with this software but at their OWN RISK.\n\nPreamble\n\nThe author has absolutely no clue what the code in this project does. It might just work or not, there is no third option.\n\nGOOD LUCK WITH THAT PUBLIC LICENSE\n\nTERMS AND CONDITIONS FOR COPYING, DISTRIBUTION, AND MODIFICATION\n\n0. You just DO WHATEVER YOU WANT TO as long as you NEVER LEAVE A TRACE TO TRACK THE AUTHOR of the original product to blame for or hold responsible.\n\nIN NO EVENT SHALL THE AUTHORS BE LIABLE FOR ANY CLAIM, DAMAGES OR OTHER LIABILITY, WHETHER IN AN ACTION OF CONTRACT, TORT OR OTHERWISE, ARISING FROM, OUT OF OR IN CONNECTION WITH THE SOFTWARE OR THE USE OR OTHER DEALINGS IN THE SOFTWARE.\n\nGood luck and Godspeed.",
    "type": "source-available"
}